{
  "id": "knowledge.nkwiki-article-374",
  "title": "4.2.2轮回塔第二层-20220106",
  "category": "dungeons",
  "aliases": [],
  "tags": [
    "第四章 副本"
  ],
  "provenance": {
    "source": "author",
    "attribution": "作者",
    "acquired_via": "nkwiki",
    "url": "https://nkwiki.cc/",
    "locator": "article:374",
    "source_updated_at": "2026-10-10T07:01:48.594Z",
    "fetched_at": "2026-10-22T03:24:44+00:00",
    "content_sha256": "cdfa398fcbc2eeeecc8c3aaa4b31911f65b7f32ece476186423015408ac0adaa",
    "license": "LicenseRef-Original-Source",
    "publication": "metadata-only",
    "origin_rule": "summary-chapter"
  },
  "review": {
    "status": "draft",
    "reviewer": null,
    "reviewed_at": null
  },
  "imported": true,
  "credit_eligible": false,
  "duplicate_of": "knowledge.author-summary-4feede831d13521a"
}
