{
  "id": "knowledge.nkwiki-equipment-296",
  "title": "征服箭袋",
  "category": "equipment",
  "aliases": [],
  "tags": [
    "副手"
  ],
  "provenance": {
    "source": "nkwiki",
    "attribution": "nkwiki",
    "acquired_via": "nkwiki",
    "url": "https://nkwiki.cc/",
    "locator": "equipment:296",
    "source_updated_at": "2026-07-03T20:08:04.580Z",
    "fetched_at": "2026-10-22T03:24:44+00:00",
    "content_sha256": "1bb0ab68bdf44cf8eb9f8074843a1de0a74466da79cc37c3d0213d15fa46e7b2",
    "license": "LicenseRef-Original-Source",
    "publication": "metadata-only",
    "origin_rule": "direct-source"
  },
  "review": {
    "status": "draft",
    "reviewer": null,
    "reviewed_at": null
  },
  "imported": true,
  "credit_eligible": false
}
