{
  "id": "knowledge.nkwiki-gem-attributes-20",
  "title": "献祭",
  "category": "gem-attributes",
  "aliases": [],
  "tags": [
    "gem-attributes"
  ],
  "provenance": {
    "source": "nkwiki",
    "attribution": "nkwiki",
    "acquired_via": "nkwiki",
    "url": "https://nkwiki.cc/",
    "locator": "gem_attributes:20",
    "source_updated_at": "2026-10-19T07:30:19.356Z",
    "fetched_at": "2026-10-22T03:24:44+00:00",
    "content_sha256": "f95cc98e93d6711c50c254e35035001cb703ddd820a284e95524a68b6575951d",
    "license": "LicenseRef-Original-Source",
    "publication": "metadata-only",
    "origin_rule": "direct-source"
  },
  "review": {
    "status": "draft",
    "reviewer": null,
    "reviewed_at": null
  },
  "imported": true,
  "credit_eligible": false
}
