{
  "id": "knowledge.author-summary-2d43d85fe6e7b2a9",
  "title": "7.4.3音乐",
  "category": "systems",
  "aliases": [],
  "tags": [
    "数据摘要",
    "第七章 玩家"
  ],
  "provenance": {
    "source": "author",
    "attribution": "作者",
    "acquired_via": "local-file",
    "url": "https://nkwiki.cc/",
    "locator": "第七章 玩家 / 7.4私域 / 7.4.3音乐",
    "source_updated_at": null,
    "fetched_at": "2026-10-22T03:24:44+00:00",
    "content_sha256": "0ad3333026c4c52866ff0f97cd4d106d8779df95a185ad008f85e94350c27c22",
    "license": "LicenseRef-Original-Source",
    "publication": "metadata-only",
    "origin_rule": "direct-summary"
  },
  "review": {
    "status": "draft",
    "reviewer": null,
    "reviewed_at": null
  },
  "imported": true,
  "credit_eligible": false
}
