{
  "id": "knowledge.author-summary-2b0cdf8b4b3ea2db",
  "title": "5.7.1克制关系一览图",
  "category": "pets",
  "aliases": [],
  "tags": [
    "数据摘要",
    "第五章 跟宠"
  ],
  "provenance": {
    "source": "author",
    "attribution": "作者",
    "acquired_via": "local-file",
    "url": "https://nkwiki.cc/",
    "locator": "第五章 跟宠 / 5.7跟宠克制关系 / 5.7.1克制关系一览图",
    "source_updated_at": null,
    "fetched_at": "2026-10-22T03:24:44+00:00",
    "content_sha256": "c7f14f0d58ab31288a39d6adbb3d9bace1cda8bd0e173accebab12e15218b5ac",
    "license": "LicenseRef-Original-Source",
    "publication": "metadata-only",
    "origin_rule": "direct-summary"
  },
  "review": {
    "status": "draft",
    "reviewer": null,
    "reviewed_at": null
  },
  "imported": true,
  "credit_eligible": false
}
