{
  "id": "knowledge.nkwiki-equipment-159",
  "title": "传说龙爪 III 阶",
  "category": "equipment",
  "aliases": [],
  "tags": [
    "副手"
  ],
  "provenance": {
    "source": "nkwiki",
    "attribution": "nkwiki",
    "acquired_via": "nkwiki",
    "url": "https://nkwiki.cc/",
    "locator": "equipment:159",
    "source_updated_at": "2026-06-29T02:40:28.514Z",
    "fetched_at": "2026-10-22T03:24:44+00:00",
    "content_sha256": "f23463d64556add3a4cc3a370d5c4362a792dbf59f102e436685469e28b27c73",
    "license": "LicenseRef-Original-Source",
    "publication": "metadata-only",
    "origin_rule": "direct-source"
  },
  "review": {
    "status": "draft",
    "reviewer": null,
    "reviewed_at": null
  },
  "imported": true,
  "credit_eligible": false
}
