{
  "id": "knowledge.nkwiki-equipment-123",
  "title": "传说镰刀 III 阶",
  "category": "equipment",
  "aliases": [],
  "tags": [
    "主手"
  ],
  "provenance": {
    "source": "nkwiki",
    "attribution": "nkwiki",
    "acquired_via": "nkwiki",
    "url": "https://nkwiki.cc/",
    "locator": "equipment:123",
    "source_updated_at": "2026-06-25T07:16:14.637Z",
    "fetched_at": "2026-10-22T03:24:44+00:00",
    "content_sha256": "2e44235c4fa43f445e61a255ac67c8613f378380d009bf73496ebb1dae465e03",
    "license": "LicenseRef-Original-Source",
    "publication": "metadata-only",
    "origin_rule": "direct-source"
  },
  "review": {
    "status": "draft",
    "reviewer": null,
    "reviewed_at": null
  },
  "imported": true,
  "credit_eligible": false
}
