{
  "id": "knowledge.author-summary-e7c4dc3cc98f1a26",
  "title": "7.1.3.2伴侣纪念礼物",
  "category": "systems",
  "aliases": [],
  "tags": [
    "数据摘要",
    "第七章 玩家"
  ],
  "provenance": {
    "source": "author",
    "attribution": "作者",
    "acquired_via": "local-file",
    "url": "https://nkwiki.cc/",
    "locator": "第七章 玩家 / 7.1玩家基础数据（未完成） / 7.1.3伴侣 / 7.1.3.2伴侣纪念礼物",
    "source_updated_at": null,
    "fetched_at": "2026-10-22T03:24:44+00:00",
    "content_sha256": "1445acba8c2c2967546eca1806d0e31f95decba9e7e24dda999245701096cee9",
    "license": "LicenseRef-Original-Source",
    "publication": "metadata-only",
    "origin_rule": "direct-summary"
  },
  "review": {
    "status": "draft",
    "reviewer": null,
    "reviewed_at": null
  },
  "imported": true,
  "credit_eligible": false
}
