{
  "id": "knowledge.nkwiki-equipment-9",
  "title": "骑士战靴",
  "category": "equipment",
  "aliases": [],
  "tags": [
    "战靴"
  ],
  "provenance": {
    "source": "nkwiki",
    "attribution": "nkwiki",
    "acquired_via": "nkwiki",
    "url": "https://nkwiki.cc/",
    "locator": "equipment:9",
    "source_updated_at": "2026-06-24T04:21:49.105Z",
    "fetched_at": "2026-10-22T03:24:44+00:00",
    "content_sha256": "5be88eacd0a12bac567b6580dc544e598fb0d7678e5cb6279220ba2e99d25949",
    "license": "LicenseRef-Original-Source",
    "publication": "metadata-only",
    "origin_rule": "direct-source"
  },
  "review": {
    "status": "draft",
    "reviewer": null,
    "reviewed_at": null
  },
  "imported": true,
  "credit_eligible": false
}
