{
  "id": "knowledge.nkwiki-article-526",
  "title": "9.3.1.2Ⅱ阶升Ⅲ阶的升阶任务",
  "category": "equipment",
  "aliases": [],
  "tags": [
    "第九章 传说武器-装备"
  ],
  "provenance": {
    "source": "author",
    "attribution": "作者",
    "acquired_via": "nkwiki",
    "url": "https://nkwiki.cc/",
    "locator": "article:526",
    "source_updated_at": "2026-10-10T07:01:48.594Z",
    "fetched_at": "2026-10-22T03:24:44+00:00",
    "content_sha256": "c11b14b5d87aa749ea97a6acf8598c37a5e14caacf523f4c12289ac7f6f6720a",
    "license": "LicenseRef-Original-Source",
    "publication": "metadata-only",
    "origin_rule": "summary-chapter"
  },
  "review": {
    "status": "draft",
    "reviewer": null,
    "reviewed_at": null
  },
  "imported": true,
  "credit_eligible": false,
  "duplicate_of": "knowledge.author-summary-9aa5779856dbf586"
}
