{
  "id": "knowledge.nkwiki-equipment-279",
  "title": "传说之弓 IV 阶",
  "category": "equipment",
  "aliases": [],
  "tags": [
    "主手"
  ],
  "provenance": {
    "source": "nkwiki",
    "attribution": "nkwiki",
    "acquired_via": "nkwiki",
    "url": "https://nkwiki.cc/",
    "locator": "equipment:279",
    "source_updated_at": "2026-10-14T13:13:55.728Z",
    "fetched_at": "2026-10-22T03:24:44+00:00",
    "content_sha256": "c9cc80793a5797c7751ef0e29f020bff747881cd81dbcbc31d20b588e5424dd2",
    "license": "LicenseRef-Original-Source",
    "publication": "metadata-only",
    "origin_rule": "direct-source"
  },
  "review": {
    "status": "draft",
    "reviewer": null,
    "reviewed_at": null
  },
  "imported": true,
  "credit_eligible": false
}
