{
  "id": "knowledge.nkwiki-article-548",
  "title": "6.2.11露莎法斯-210625（四星）",
  "category": "fairies",
  "aliases": [],
  "tags": [
    "第六章 精灵"
  ],
  "provenance": {
    "source": "author",
    "attribution": "作者",
    "acquired_via": "nkwiki",
    "url": "https://nkwiki.cc/",
    "locator": "article:548",
    "source_updated_at": "2026-10-10T07:01:48.594Z",
    "fetched_at": "2026-10-22T03:24:44+00:00",
    "content_sha256": "eb526d0cfdfa8a57330d593fbd1b59360de83c08acfb65f7a7c59a4fcb4598a6",
    "license": "LicenseRef-Original-Source",
    "publication": "metadata-only",
    "origin_rule": "summary-chapter"
  },
  "review": {
    "status": "draft",
    "reviewer": null,
    "reviewed_at": null
  },
  "imported": true,
  "credit_eligible": false
}
