{
  "id": "knowledge.nkwiki-article-398",
  "title": "5.3.3.1商店1",
  "category": "pets",
  "aliases": [],
  "tags": [
    "第五章 跟宠"
  ],
  "provenance": {
    "source": "author",
    "attribution": "作者",
    "acquired_via": "nkwiki",
    "url": "https://nkwiki.cc/",
    "locator": "article:398",
    "source_updated_at": "2026-10-10T07:01:48.594Z",
    "fetched_at": "2026-10-22T03:24:44+00:00",
    "content_sha256": "4e5323c5f477752f2145c1ca664471009a15900968434a9fa4b048f50baf9529",
    "license": "LicenseRef-Original-Source",
    "publication": "metadata-only",
    "origin_rule": "summary-chapter"
  },
  "review": {
    "status": "draft",
    "reviewer": null,
    "reviewed_at": null
  },
  "imported": true,
  "credit_eligible": false
}
