{
  "id": "knowledge.nkwiki-article-658",
  "title": "3.6.7场内不同阶段",
  "category": "pvp",
  "aliases": [],
  "tags": [
    "第三章 PVP数据总结"
  ],
  "provenance": {
    "source": "author",
    "attribution": "作者",
    "acquired_via": "nkwiki",
    "url": "https://nkwiki.cc/",
    "locator": "article:658",
    "source_updated_at": "2026-10-10T07:01:48.594Z",
    "fetched_at": "2026-10-22T03:24:44+00:00",
    "content_sha256": "69c4a39d8e6f731a2ca7c278f886aab5eed83fcb0c191b647093daa901ec8213",
    "license": "LicenseRef-Original-Source",
    "publication": "metadata-only",
    "origin_rule": "summary-chapter"
  },
  "review": {
    "status": "draft",
    "reviewer": null,
    "reviewed_at": null
  },
  "imported": true,
  "credit_eligible": false,
  "duplicate_of": "knowledge.author-summary-d21481b006de5ef2"
}
