{
  "id": "knowledge.nkwiki-article-695",
  "title": "2.5.2附魔说明",
  "category": "pve",
  "aliases": [],
  "tags": [
    "第二章 PVE数据总结"
  ],
  "provenance": {
    "source": "author",
    "attribution": "作者",
    "acquired_via": "nkwiki",
    "url": "https://nkwiki.cc/",
    "locator": "article:695",
    "source_updated_at": "2026-10-10T07:01:48.594Z",
    "fetched_at": "2026-10-22T03:24:44+00:00",
    "content_sha256": "f146193b733ad8d8b804d959cda233a666a705dd38358fa03b2e1a70ce5ab41c",
    "license": "LicenseRef-Original-Source",
    "publication": "metadata-only",
    "origin_rule": "summary-chapter"
  },
  "review": {
    "status": "draft",
    "reviewer": null,
    "reviewed_at": null
  },
  "imported": true,
  "credit_eligible": false
}
