{
  "id": "knowledge.nkwiki-article-557",
  "title": "6.2.1希尔芙-200817（三星）",
  "category": "fairies",
  "aliases": [],
  "tags": [
    "第六章 精灵"
  ],
  "provenance": {
    "source": "author",
    "attribution": "作者",
    "acquired_via": "nkwiki",
    "url": "https://nkwiki.cc/",
    "locator": "article:557",
    "source_updated_at": "2026-10-10T07:01:48.594Z",
    "fetched_at": "2026-10-22T03:24:44+00:00",
    "content_sha256": "dfcf9a8cd5d64d191b309e5d6c94b5c0d9537d317acee5f509a6d93d3bd950c3",
    "license": "LicenseRef-Original-Source",
    "publication": "metadata-only",
    "origin_rule": "summary-chapter"
  },
  "review": {
    "status": "draft",
    "reviewer": null,
    "reviewed_at": null
  },
  "imported": true,
  "credit_eligible": false
}
