{
  "id": "knowledge.author-summary-2eeba3cfb3011cfd",
  "title": "3.3各个职业的面板数据",
  "category": "pvp",
  "aliases": [],
  "tags": [
    "数据摘要",
    "第三章 PVP数据总结"
  ],
  "provenance": {
    "source": "author",
    "attribution": "作者",
    "acquired_via": "local-file",
    "url": "https://nkwiki.cc/",
    "locator": "第三章 PVP数据总结 / 3.3各个职业的面板数据",
    "source_updated_at": null,
    "fetched_at": "2026-10-22T03:24:44+00:00",
    "content_sha256": "45b60e50a17f618c77afcdf191661f3b092de33575cd0a71428018cad0ceddc6",
    "license": "LicenseRef-Original-Source",
    "publication": "metadata-only",
    "origin_rule": "direct-summary"
  },
  "review": {
    "status": "draft",
    "reviewer": null,
    "reviewed_at": null
  },
  "imported": true,
  "credit_eligible": false
}
