{
  "id": "knowledge.nkwiki-article-321",
  "title": "4.0.4.4副本跨T破甲增益",
  "category": "dungeons",
  "aliases": [],
  "tags": [
    "第四章 副本"
  ],
  "provenance": {
    "source": "author",
    "attribution": "作者",
    "acquired_via": "nkwiki",
    "url": "https://nkwiki.cc/",
    "locator": "article:321",
    "source_updated_at": "2026-10-10T07:01:48.594Z",
    "fetched_at": "2026-10-22T03:24:44+00:00",
    "content_sha256": "5d1d2caff9872a7e645251a0e131d316cce34887e46bdc89f6ef195c7fa87af5",
    "license": "LicenseRef-Original-Source",
    "publication": "metadata-only",
    "origin_rule": "summary-chapter"
  },
  "review": {
    "status": "draft",
    "reviewer": null,
    "reviewed_at": null
  },
  "imported": true,
  "credit_eligible": false
}
